twitter_id,screen_name,created_at,verified,location,followers_count,friends_count,favourites_count,statuses_count
17886066,wolfsbruder,Fri Dec 05 01:27:17 +0000 2008,False,"Seattle, WA",171,776,1616,1133
 
created_at,full_text,retweet_count,favorite_count,twitter_url
tired
2020-04-30 09:27:02,"It is hard to project my voice.  So if I don't take your phone call, it's because I am too tired to.
If I don't respond to you promptly, it's because I am too tired to.",0,0,https://twitter.com/wolfsbruder/status/1255790755681046532
cough
2020-04-13 01:12:02,"I have atypical symptoms.  I have more exhaustion than usual,  I have been having bad headaches a lot (not migraines, I know the difference as I live with chronic migraines), and I do have a dry cough now.  I also have a heart arrhythmia.
What I don't have is a fever.",0,2,https://twitter.com/wolfsbruder/status/1249505592831430656
dry cough
2020-04-13 01:12:02,"I have atypical symptoms.  I have more exhaustion than usual,  I have been having bad headaches a lot (not migraines, I know the difference as I live with chronic migraines), and I do have a dry cough now.  I also have a heart arrhythmia.
What I don't have is a fever.",0,2,https://twitter.com/wolfsbruder/status/1249505592831430656
headaches
2020-04-13 01:12:02,"I have atypical symptoms.  I have more exhaustion than usual,  I have been having bad headaches a lot (not migraines, I know the difference as I live with chronic migraines), and I do have a dry cough now.  I also have a heart arrhythmia.
What I don't have is a fever.",0,2,https://twitter.com/wolfsbruder/status/1249505592831430656
diagnosed with covid
2020-04-13 01:12:02,"ok, so this is post is hard for me.
I am struggling with depression.
I want to cry, and I have no tears left.
I have been diagnosed with covid-19.",0,3,https://twitter.com/wolfsbruder/status/1249505592076464128
tested positive
2020-03-20 22:52:22,Well fuck.  One the tenants in this building has tested positive.,0,0,https://twitter.com/wolfsbruder/status/1241135522564567041
